review id,author_id,listing_id,body,cleanliness,communication,checkin,accuracy,location,value,,
72,95,6,"Our stay at the waterfront bungalow was everything we could have ever hoped for. From the moment we stepped foot onto the terrace, we were immediately captivated by the stunning views that greeted us. The sight of the islands in the Bay of Kotor was simply breathtaking.

The bungalow itself was well-appointed and had everything we needed for a comfortable stay. The interior was tastefully decorated and had a cozy, welcoming atmosphere. It truly felt like a home away from home.

But it was the terrace that stole the show. We spent countless hours out there, savoring every moment of the panoramic views. Whether it was enjoying a cup of coffee in the morning or sipping a glass of wine in the evening, there was no better place to be than on that terrace.

The location of the bungalow was also ideal. It was close to various amenities, including restaurants, shops, and attractions. We took full advantage of this and explored the charming town at our leisure. And whenever we wanted to escape the hustle and bustle, we simply retreated to the serenity of our bungalow.

I cannot recommend the waterfront bungalow enough. It provided us with a truly memorable and enjoyable stay. If you're looking for a place that offers both comfort and spectacular views, then this is the place for you. Trust me, you won't be disappointed.",4,3,5,5,4,4,,
73,26,7,"I recently had the pleasure of staying at this charming waterfront studio and I can't say enough about how amazing it was. From the moment I walked in, I was blown away by the breathtaking views. The mountain views were particularly mesmerizing and I found myself constantly gazing out the window, taking in the beauty of nature.

The studio itself was cozy and welcoming. It had everything I needed for a perfect getaway. The bed was incredibly comfortable and I slept like a baby every night. The kitchenette was well-equipped, allowing me to prepare some simple meals. The seating area was perfect for enjoying meals or just relaxing with a book.

One of the highlights of my stay was exploring the surrounding area. The waterfront location provided easy access to various water activities. I had a blast kayaking and paddleboarding, and even managed to catch a stunning sunset while out on the water. It truly felt like a dream come true.

Another aspect that made my stay memorable was the hospitality of the host. They were extremely friendly and attentive, ensuring that I had everything I needed for a comfortable stay. They provided useful recommendations for local attractions and restaurants, which enhanced my overall experience.

Overall, I couldn't have asked for a better stay. This charming waterfront studio exceeded all my expectations and provided the perfect escape from the hustle and bustle of everyday life. I would highly recommend it to anyone looking for a peaceful and picturesque getaway. I can't wait to return in the future!",4,5,5,5,5,5,,
74,68,8,"Our experience at the peaceful retreat near SF was absolutely amazing. The highlight for us was definitely the direct beach access, which added so much excitement and convenience to our stay. The cozy atmosphere and tranquil surroundings further enhanced the entire experience, making it truly relaxing and rejuvenating. We cannot recommend this place enough. Whether you're looking for a peaceful getaway or a fun-filled beach vacation, this retreat has it all. Don't miss out on this hidden gem!",5,4,5,3,5,5,,
75,8,9,"We had the most amazing time staying at this hidden gem by the beach. From the moment we arrived, we were blown away by the stunning ocean views that greeted us. Every morning, we woke up to the sound of crashing waves and a breathtaking vista that felt like a dream.

But it wasn't just the views that made our stay unforgettable. The hot tub, nestled perfectly on the property, provided an unparalleled relaxation experience. Not only did it offer a soothing soak after a long day of exploring, but it also gave us the opportunity to take in the incredible scenery. As we lounged in the warm bubbles while overlooking the vastness of the ocean, we felt a sense of tranquility wash over us.

The entire property was meticulously maintained and thoughtfully designed. The attention to detail was evident in every aspect, from the stylish decor to the comfortable furnishings. We felt like we were in our own private paradise, far away from the hustle and bustle of everyday life.

We can't wait to return to this little piece of heaven. The memories we created during our stay will last a lifetime, and we are already counting down the days until we can go back. Anyone looking for a peaceful getaway with breathtaking views, this is the place to be. Trust us, you won't be disappointed.",5,4,4,4,4,5,,
76,35,10,"The secluded treehouse retreat exceeded all of our expectations and provided us with an absolutely incredible stay. The moment we arrived, we were immediately captivated by the stunning views surrounding the property. It was truly a haven of tranquility, tucked away from the bustling city life.

The location was perfect for our needs, as we were able to easily visit UC Berkeley and explore the vibrant downtown of San Francisco. Being able to escape to the treehouse retreat after a long day of sightseeing was an added bonus. The peaceful atmosphere and serene surroundings made it feel like we were miles away from civilization.

The treehouse itself was a work of art, beautifully constructed with attention to every detail. The interior was cozy and inviting, with all the amenities one could need for a comfortable stay. Waking up to the sound of birds chirping and the soft rustling of leaves was a true delight.

We were also incredibly grateful for the excellent hospitality provided by our hosts. They were attentive, friendly, and made sure that we had everything we needed throughout our stay. Their warmth and genuine care made the experience even more memorable.

Overall, our time at the secluded treehouse retreat was nothing short of magical. It offered the perfect blend of relaxation, natural beauty, and convenience. We left feeling refreshed and rejuvenated, with memories that will last a lifetime. A heartfelt thank you to our hosts for providing such a wonderful experience. We can't wait to return!",4,5,5,5,4,4,,
77,37,11,"We had such a fabulous time at the luxurious cabin in the tranquil woodland. It truly felt like a dream getaway. The surroundings were absolutely picturesque, and the cozy atmosphere added to the overall charm of the place. One of the best parts was the canal-front location. It was incredible to be able to relax and unwind while enjoying the stunning views. I cannot recommend this stay enough. It was truly fantastic and exceeded all of our expectations.",4,4,4,5,4,5,,
78,71,12,"We recently had the pleasure of staying at this luxurious retreat and we were blown away by the entire experience. From the moment we walked into the charming 100-year-old school house, we knew we were in for a special treat. The atmosphere was cozy and inviting, with thoughtful touches that truly made us feel at home.

But the real highlight of our stay was the Finnish sauna. We had heard great things about it, but nothing could have prepared us for just how amazing it was. The heat and steam provided a level of relaxation that we had never experienced before. It was the perfect way to unwind after a long day of exploring the nearby hiking trails.

Speaking of which, the location of this retreat is simply unparalleled. Nestled in the midst of nature, it offered breathtaking views and a serene ambiance that made it hard to leave. We found ourselves spending hours just sitting on the porch, taking in the beauty all around us.

Every moment of our stay was thoroughly enjoyable. The staff was exceptionally friendly and helpful, making sure we had everything we needed. The attention to detail in every aspect of the retreat was remarkable.

If you're looking for a truly unforgettable retreat, we cannot recommend this place highly enough. Whether you're seeking relaxation, adventure, or simply a getaway from the hustle and bustle of everyday life, this retreat has it all. Don't miss out on the opportunity to create lasting memories in this little slice of heaven.",5,5,5,4,4,5,,
79,94,13,"We had a truly magical stay at the charming historic schoolhouse near Monterey Bay. From the moment we stepped foot onto the private vineyard surrounding the property, we knew we were in for a luxurious experience. The ambiance of the schoolhouse was incredible, with its rich history and charming architecture. It felt like we were living in a fairytale.

The attention to detail in this listing was exceptional. Every corner of the schoolhouse was filled with character and charm, from the vintage furniture to the beautiful artwork hanging on the walls. We were blown away by how well-preserved the historic nature of the property was. It truly felt like stepping back in time.

The location of this listing was also ideal. Not only were we able to explore the nearby attractions of Monterey Bay, but we also had the opportunity to relax and unwind in the tranquility of the private vineyard. We spent our evenings sipping wine and enjoying the breathtaking views of the surrounding countryside.

The hosts were incredibly accommodating and helpful throughout our stay. They provided us with all the necessary information and recommendations to make the most of our time in the area. Their passion for the schoolhouse and its history was evident, and it added an extra layer of charm to our stay.

Overall, our experience at the historic schoolhouse near Monterey Bay was absolutely delightful. It was a perfect blend of luxury, charm, and tranquility. We couldn't have asked for a better getaway and would highly recommend this listing to anyone looking for a truly magical stay.",4,4,5,4,5,4,,
80,42,14,"Our stay at this luxurious vineyard retreat was simply awe-inspiring. The infinity pool, with its breathtaking views, coupled with the exclusivity of the estate, truly elevated our experience to extraordinary heights.

From the moment we arrived, we were overwhelmed by the sheer beauty and elegance of the property. Nestled within the picturesque vineyards, the retreat encompassed a sense of tranquility and serenity that was unmatched. The well-maintained gardens and lush greenery surrounding the estate added to its overall charm.

The highlight of our stay was undoubtedly the infinity pool. Its seamless blend with the surrounding landscape created an illusion of swimming into the enchanting horizon. We spent hours submerged in its crystal-clear waters, marveling at the majestic views that stretched out before us. It was an experience that will forever be etched in our memories.

Moreover, the exclusivity of the estate enhanced our overall stay. The sense of privacy and seclusion allowed us to truly unwind and disconnect from the outside world. The attentive staff members catered to our every need, ensuring that our stay was nothing short of perfection. Their warm hospitality and attention to detail truly added to the overall luxuriousness of our experience.

In addition to the remarkable amenities, the vineyard retreat also boasted a magnificent wine selection. We had the opportunity to indulge in some of the finest wines the region had to offer. The knowledgeable sommelier guided us through a delightful tasting journey, enlightening us with the rich history and flavors of each sip.

Overall, our stay at this luxurious vineyard retreat was beyond compare. The combination of the incredible infinity pool, exclusive estate, and impeccable service left us utterly captivated. If you are in search of a unique and extraordinary experience, look no further. We cannot recommend this retreat enough for a truly unforgettable getaway.",3,5,5,4,5,3,,
81,42,15,"We had an absolutely incredible stay at this sustainable getaway in Joshua Tree. The views from the property were absolutely breathtaking, with stunning vistas of the surrounding natural beauty. The organic architecture of the accommodation really provided a unique experience that made us feel truly immersed in nature. It was such a peaceful and tranquil setting, allowing us to truly relax and unwind. We loved every minute of our stay and would highly recommend this special place to anyone seeking a peaceful and rejuvenating getaway.",5,5,4,4,5,4,,
82,70,16,"We had the most memorable stay at Eagle's Watch. The moment we walked into our room and saw the breathtaking ocean views, our jaws dropped. It was like stepping into a dream. The design of the entire property was simply exquisite, with a perfect blend of modern and sustainable elements. We loved how the owners paid attention to every detail, from the eco-friendly materials used to the quirky and charming decor. It added such a unique and whimsical touch to our whole experience.

Not only was the design impressive, but the overall ambiance of Eagle's Watch was incredibly welcoming and relaxing. The staff went above and beyond to ensure that we had everything we needed and were always available to answer any questions or provide recommendations. Their warmth and genuine hospitality truly made us feel at home.

One of the highlights of our stay was waking up to the sound of crashing waves and enjoying our morning coffee on the balcony while soaking in the panoramic ocean views. It was a truly awe-inspiring sight that we can still picture in our minds, even long after our stay.

The location of Eagle's Watch was also perfect for exploring the surrounding area. We took advantage of the nearby hiking trails and spent our afternoons discovering hidden coves and pristine beaches. It felt like our own little paradise away from the hustle and bustle of everyday life.

Overall, our time at Eagle's Watch exceeded all expectations. The stunning ocean views, the eco-friendly design, and the warm hospitality made it an unforgettable experience. We couldn't have asked for a better getaway and we are already planning our next visit. We highly recommend Eagle's Watch to anyone seeking a truly remarkable and rejuvenating escape.",4,5,4,5,5,4,,
83,5,17,"I recently had the pleasure of staying at the luxury modern marvel and I must say, it was absolutely breathtaking! The moment I walked in, I was captivated by its stunning views. The retreat, designed by none other than the renowned architect Frank Lloyd Wright, was a true masterpiece.

Every detail of the property exuded elegance and sophistication. From the sleek and minimalist design to the high-end finishes, it was clear that no expense was spared in creating this architectural gem. The interior spaces were thoughtfully laid out, allowing for a seamless flow between rooms and making the most of the surrounding natural beauty.

But it was the views that truly stole the show. The expansive windows and balconies provided panoramic vistas of the surrounding landscape, and I found myself constantly in awe of the beauty that lay before me. Whether it was the majestic mountains in the distance or the serene waterfront, every view was a work of art.

The level of comfort and luxury provided by this retreat was exemplary. The bedrooms were spacious and beautifully appointed, with plush beds and high-quality linens that made for a restful night's sleep. The bathrooms were equally impressive, featuring modern fixtures and luxurious amenities.

I also appreciated the attention to detail and personalized touches throughout my stay. From the welcoming gift upon arrival to the well-stocked kitchen and thoughtful concierge service, every aspect of my experience was tailored to perfection.

Overall, my stay at this luxury modern marvel was an unforgettable experience. It truly was a masterpiece in every sense of the word, and I cannot recommend it highly enough. If you're looking for a truly exceptional retreat, this is the place to be.",4,5,5,4,5,5,,
84,87,18,"I cannot express enough how amazing our stay at this desert oasis was. From the moment we arrived, we were enchanted by the breathtaking architecture designed by the legendary Frank Lloyd Wright. Every corner of this place oozed with elegance and sophistication.

But it wasn't just the stunning architecture that made this experience unforgettable. The peaceful desert surroundings added an element of tranquility that completed the luxurious atmosphere. It felt like we were in our own little paradise, far away from the hustle and bustle of the city.

The attention to detail in every aspect of this oasis was unparalleled. From the perfectly manicured gardens to the meticulously designed interior, everything was simply exquisite. We felt like royalty as we lounged by the pool, surrounded by the serenity of the desert.

The staff were incredibly warm and attentive, making sure that our every need was taken care of. They went above and beyond to ensure that we had the most enjoyable stay possible. Their exceptional service truly added to the overall experience and made us feel valued and pampered.

Overall, our getaway at this desert oasis was beyond anything we could have ever imagined. It was a haven of luxury and relaxation, and we left feeling rejuvenated and utterly spoiled. If you're looking for a truly extraordinary experience, this is the place to be. Trust me, you won't be disappointed.",4,4,4,5,5,4,,
85,20,19,"Our stay at this cabin was nothing short of enchanting. From the moment we arrived, we were completely surrounded by the beauty of nature. The cabin itself was cozy and inviting, and the breathtaking views of Lake Tahoe took our breath away.

Waking up each morning to the gorgeous sight of the lake shimmering in the sunlight was a dream come true. We spent our days exploring the nearby hiking trails, immersing ourselves in the tranquility of the surrounding forest. There was something magical about being able to disconnect from the outside world and be fully present in the natural beauty that surrounded us.

The cabin itself was well-appointed and had everything we needed for a comfortable stay. The attention to detail was evident in every aspect, from the comfortable bed to the cozy fireplace. We loved coming back to the cabin after a day of adventures to relax and unwind, all while enjoying the stunning views from our private deck.

One of the highlights of our stay was the romantic atmosphere that the cabin created. Whether we were cuddling up by the fire or sipping wine on the deck, the cabin provided the perfect setting for a romantic getaway. The peacefulness of the surroundings allowed us to reconnect and create lifelong memories together.

The location of the cabin was also ideal. We were just a short drive away from the charming town of Tahoe City, where we enjoyed exploring local shops and dining at delicious restaurants. Additionally, being so close to Lake Tahoe meant that we could easily take advantage of water activities such as kayaking and paddleboarding.

Overall, our stay at this cabin was truly memorable. The combination of the breathtaking views of Lake Tahoe, the cozy and well-appointed cabin, and the enchanting atmosphere made it a perfect getaway. We can't wait to return and experience the magic all over again.",4,5,5,5,4,4,,
86,17,20,"I had the most incredible stay at this place. The views of Lake Tahoe were absolutely mesmerizing and I was left speechless every time I looked out the window. The accommodation itself felt like pure luxury. Every detail was carefully thought out, from the comfortable beds to the stylish and modern furniture. The added bonus of having secure garage parking was such a relief. I didn't have to worry about finding a parking spot or my car's safety. It was such a peace of mind. Overall, I couldn't have asked for a better experience. The stay was perfect and I would highly recommend this place to anyone looking for a luxurious and unforgettable stay in Lake Tahoe.",5,4,5,5,5,4,,
87,87,21,"We just returned from a fantastic stay at this remarkable property. Our experience was nothing short of perfect from start to finish. The location was incredibly convenient, and the spaciousness of the place was a pleasant surprise.

As a family, we truly appreciated the attention to detail that was evident throughout the property. It was evident that the hosts had put a lot of thought into ensuring the comfort and convenience of their guests. We were able to relax and unwind in a clean and well-maintained space, which immediately made us feel at home.

One of the highlights of our stay was the opportunity to immerse ourselves in nature at MICA. The property's close proximity to this stunning natural reserve allowed us to easily enjoy all that it had to offer. We spent hours exploring the beautiful trails, taking in the breathtaking scenery, and simply reconnecting with nature.

The hosts were also incredibly accommodating and friendly. They were always available to answer any questions we had and provide helpful recommendations for local attractions and dining options. Their hospitality truly exceeded our expectations and made our stay even more enjoyable.

Overall, we couldn't be happier with our experience at this wonderful property. It provided the perfect combination of convenience, comfort, and immersion in nature. We highly recommend it to anyone looking for a memorable getaway. We can't wait to return.",5,5,5,4,4,4,,
88,34,22,"We had an unforgettable experience during our stay at this lakefront estate in Quebec. The moment we arrived, we were captivated by the mesmerizing beauty of the surrounding nature. The breathtaking views of the lake and mountains were beyond compare and provided a serene backdrop for our entire stay.

The house itself was nothing short of perfection. From the charming exterior to the cozy and inviting interior, every detail was carefully thought out and designed to provide the utmost comfort and relaxation. We were pleasantly surprised by the spacious rooms and luxurious amenities that this estate had to offer. It truly felt like our own private oasis.

Furthermore, the house was equipped with everything we could possibly need during our stay. The fully stocked kitchen made it easy for us to prepare delicious meals and enjoy them while taking in the stunning views from the dining area. The living room was incredibly cozy, perfect for curling up with a book or simply unwinding after a day of exploring.

One of the highlights of our stay was the outdoor space. The expansive patio offered the perfect setting for enjoying a morning coffee while listening to the sounds of nature or savoring a glass of wine as the sun set over the lake. The well-maintained garden was a delightful surprise, providing a serene space to stroll and admire the vibrant colors of the flowers.

The location of this estate was also ideal for those seeking tranquility and relaxation. We felt completely secluded from the hustle and bustle of everyday life and were able to fully immerse ourselves in the beauty and serenity of the area. Whether we were hiking in the nearby mountains or simply lounging by the lake, each moment was filled with a sense of peace and contentment.

In summary, our stay at this lakefront estate in Quebec exceeded all expectations. The breathtaking nature, comfortable accommodations, and overall tranquility made it an unforgettable experience. We highly recommend this getaway to anyone in need of a peaceful retreat.",5,4,5,5,4,5,,
89,48,23,"My stay at this luxurious lakefront resort was absolutely amazing. The location was secluded, providing the perfect retreat from the hustle and bustle of daily life. The moment I arrived, I was blown away by the top-notch amenities and the elegant ambiance of the resort.

One of the highlights of my stay was the spa. The treatments were incredibly relaxing and rejuvenating, leaving me feeling pampered and refreshed. It was a true sanctuary of tranquility, allowing me to unwind and escape from the stresses of the outside world.

Being able to have easy access to the lake was another incredible feature of this resort. Whether it was taking a leisurely stroll along the waterfront or indulging in various water activities, I thoroughly enjoyed every moment spent by the lake. The serene views and the calming sounds of the water added an extra layer of relaxation to my experience.

Overall, I cannot rave enough about my time at this lakefront resort. The combination of the secluded location, top-notch amenities, and the serene ambiance made it a truly fantastic stay. I would highly recommend this resort to anyone looking for a luxurious and rejuvenating getaway.",4,4,4,4,5,4,,
