review id,author_id,listing_id,body,cleanliness,communication,checkin,accuracy,location,value,,
90,2,24,"I cannot express how much I adored my time at this hidden gem of a lakeside cabin. From the moment I arrived, I knew I was in for a truly serene retreat. The location was simply perfect, tucked away in nature's embrace, offering peace and tranquility like no other.

The cabin itself was an absolute dream. It exuded coziness and warmth, instantly making me feel at home. Every detail was thoughtfully designed, making the space not only aesthetically pleasing but also functional. I was pleasantly surprised to find that it was well-appointed with all the amenities one could possibly need for a comfortable stay.

However, the star of the show was undeniably the breathtaking view of the lake. Oh, how I looked forward to waking up each morning and stepping onto the deck to witness the sheer beauty that laid before me. The sight of the crystal-clear water glistening under the gentle sunlight was nothing short of magical. It was a scene straight out of a painting, and I couldn't help but feel a sense of deep peace and contentment every time I took it in.

If you are searching for a place to unwind and reconnect with nature, I wholeheartedly recommend this lakeside cabin. Its serenity and seclusion create the perfect setting for a truly rejuvenating getaway. Whether you're looking to escape the hustle and bustle of everyday life or simply yearning for a peaceful retreat, this cabin will surely exceed your expectations. Don't hesitate to book your stay here; it will be an experience you won't soon forget.",4,5,5,5,5,4,,
91,64,25,"Our stay at the cabin was absolutely incredible! The location was truly a dream come true. We were mesmerized by the stunning views of the lake, it was like something out of a postcard. Being surrounded by such natural beauty was truly humbling and made our stay even more special. 

The cabin itself was so cozy and charming. It had a rustic feel to it that instantly made us feel at home. Not to mention, it was equipped with all the necessities for a comfortable stay. The kitchen had everything we needed to cook our meals, and the living area was the perfect spot to relax after a long day of exploring.

What we loved most about this cabin was its ability to help us disconnect from the outside world and truly embrace and enjoy nature. The peaceful atmosphere allowed us to unwind and forget about our everyday stresses. We spent our days hiking through the surrounding trails, fishing in the lake, and simply enjoying the tranquility that surrounded us.

We are already counting down the days until our next visit to this amazing cabin. It was the perfect getaway, and we couldn't have asked for a better experience. Thank you to the owners for providing such a wonderful place for us to escape to. We can't wait to come back and create even more unforgettable memories.",5,5,4,5,5,4,,
92,95,26,"Our experience at this cozy, spacious apartment was absolutely fantastic. The breathtaking views from the windows, especially the mesmerizing downtown views, made our stay even more remarkable. We were in awe of the gorgeous sights every time we looked out. The apartment provided all the amenities and comforts we needed, making it a perfect place to stay during our trip. We couldn't have asked for a better accommodation. Thank you for providing such a wonderful experience.",5,5,4,5,4,4,,
93,39,27,"We had the most incredible time during our stay at this beautiful Edwardian home. The recent remodel was evident in every corner, and we were blown away by its elegant and modern design. But the real highlight was the stunning city views that this place offered.

From the moment we stepped onto the balcony, we were treated to breathtaking panoramic views of the city skyline. It was like having our own personal observation deck right at our fingertips. Whether it was enjoying our morning cup of coffee or savoring a glass of wine in the evenings, we were constantly in awe of the mesmerizing vistas.

The best part was that we didn't even need to leave the comfort of the home to enjoy these remarkable views. The floor-to-ceiling windows throughout the property allowed us to admire the city from almost every room. It truly added an extra layer of luxury and gave us the feeling of being immersed in the vibrant energy of the city.

Not only were the views sensational, but the overall experience was unforgettable. The house was immaculate, with every detail taken care of to ensure our comfort. The furnishings were stylish and comfortable, and the kitchen was well-equipped with top-notch appliances. We truly felt like we were staying in a five-star hotel.

Additionally, the host was fantastic. They were incredibly friendly and accommodating, making sure that we had everything we needed for a perfect stay. From providing helpful recommendations for restaurants to ensuring the house was stocked with all the essentials, they went above and beyond to make us feel welcome.

Overall, our stay in this remodeled Edwardian home was absolutely amazing! The stunning city views enhanced our experience and made it truly unforgettable. We cannot recommend this place enough and cannot wait to come back for another memorable stay.",5,4,5,5,5,5,,
94,8,28,"We absolutely adored our stay at this tranquil and cozy house! The stunning views of the city were mesmerizing and added a touch of magic to our experience. But what truly blew us away was the private rooftop spa. Talk about luxury and relaxation at its finest! Every evening, we found ourselves soaking in the bubbling warm water, gazing at the twinkling lights of the city below. It was the perfect way to unwind after a long day of exploring. The attention to detail in this house was exceptional, with every corner exuding a sense of comfort and warmth. We truly felt at home. Whether we were curled up on the plush couches, sipping our morning coffee while overlooking the cityscape, or enjoying a delicious dinner in the well-equipped kitchen, this house provided the perfect backdrop for unforgettable moments. The owner was also incredibly accommodating and responsive, ensuring that our every need was met. We can't recommend this place enough for anyone looking for a peaceful getaway with a touch of luxury. Trust us, you won't be disappointed!",5,4,4,5,5,4,,
95,38,29,"Our experience at this luxurious urban oasis was nothing short of amazing! From the moment we arrived, we were blown away by the elegance and comfort this place had to offer. The private spa was a highlight of our stay, providing a serene atmosphere where we could fully unwind and rejuvenate ourselves. 

The location of this oasis was also a huge plus. It was conveniently situated near all the attractions we had on our itinerary. This made exploring the city a breeze, as we didn't have to spend much time commuting. It truly added an extra layer of convenience and saved us valuable time that we got to spend enjoying the sights and sounds of the city.

Overall, our time here was absolutely spectacular. The attention to detail and the level of service provided by the staff were exceptional. We felt pampered and well taken care of throughout our stay. We couldn't have asked for a better experience.

If you're looking for a top-notch accommodation that ticks all the boxes, this place is it. We would wholeheartedly recommend it to anyone looking for a luxurious and relaxing urban getaway. Don't miss out on this gem!",5,4,5,5,4,4,,
96,85,1,"This place is an absolute dream! The view is breathtaking, the glamping experience is luxurious, and the hosts are incredibly helpful and friendly. Can't wait to go back!",5,5,4,4,4,5,,
97,95,2,"Our glamping experience in the desert with a view of Mount Palomar was simply breathtaking, surpassing all expectations with its top-notch tent cabins and attention to detail.",5,4,5,3,5,5,,
98,71,3,"Our stay at this incredible glamping site exceeded all expectations, with stunning ocean views and impeccable service making for an unforgettable vacation.",4,4,4,4,5,4,,
99,36,4,"This listing was an absolute dream come true - from the stunning coastal views to the impeccable architecture and cozy living space, every detail was perfection, and the exceptional hospitality of the host truly made our stay unforgettable.",4,5,5,4,5,5,,
100,3,5,Escape to this waterfront bungalow and immerse yourself in the mesmerizing beauty of Northern California - the perfect blend of nature's tranquility and modern comfort.,5,5,5,4,4,5,,
101,59,6,"The waterfront bungalow exceeded our expectations with its breathtaking views and cozy interior, making it the perfect home away from home.",4,4,4,5,5,4,,
102,72,7,"This charming waterfront studio exceeded all my expectations and provided the perfect escape from the hustle and bustle of everyday life, I can't wait to return in the future!",5,4,4,5,5,4,,
103,16,8,"This hidden gem near SF offers a truly rejuvenating and exciting experience with direct beach access, perfect for either a peaceful getaway or a fun-filled beach vacation.",5,5,5,4,4,4,,
104,23,9,"This hidden paradise by the beach offers breathtaking ocean views and a tranquil hot tub experience, creating the perfect peaceful getaway.",4,4,4,4,4,4,,
105,28,10,"The secluded treehouse retreat surpassed all expectations and provided an enchanting getaway with breathtaking views, making it a tranquil oasis away from the hustle and bustle of the city.",5,4,4,5,4,5,,
106,90,11,"This cabin surpassed our wildest dreams with its serene woodland setting, adding a touch of magic to our getaway.",5,4,5,4,4,5,,
107,65,12,"This luxurious retreat exceeded all of our expectations, from the cozy atmosphere to the breathtaking views, it truly was a slice of heaven that will create lasting memories.",4,4,5,5,4,4,,
108,54,13,"Our stay at the historic schoolhouse near Monterey Bay was like stepping into a enchanting fairytale, filled with charm, character, and tranquility.",5,5,5,5,4,4,,
109,39,14,"Our stay at this opulent vineyard hideaway left us completely mesmerized, with its stunning infinity pool and secluded atmosphere providing an exceptional and unforgettable escape.",5,5,4,5,5,5,,
110,80,15,"This sustainable getaway in Joshua Tree offers breathtaking views and an immersive natural experience, perfect for a peaceful and rejuvenating escape.",5,4,5,5,4,5,,
111,30,16,"Eagle's Watch is an unforgettable and rejuvenating escape with stunning ocean views, eco-friendly design, and warm hospitality - a perfect getaway.",4,3,4,4,4,4,,
112,25,17,"This luxury modern marvel is an absolute masterpiece, with breathtaking views and a level of comfort and luxury that is second to none.",4,4,4,5,4,5,,
113,35,18,"This desert oasis is an absolute paradise of elegance and tranquility, where every detail is meticulously crafted to create a luxurious experience that will leave you feeling rejuvenated and utterly spoiled.",5,5,4,3,5,5,,
114,20,20,"This place offers an unforgettable and luxurious stay with mesmerizing views of Lake Tahoe, providing peace of mind with secure garage parking.",2,4,5,5,4,4,,
115,11,21,"Our stay at this extraordinary property was absolutely perfect, from the convenient location to the surprising spaciousness. The attention to detail and thoughtfulness of the hosts made us feel instantly at home, creating a relaxing and enjoyable experience. Plus, the proximity to the stunning natural reserve allowed us to fully immerse ourselves in nature. The hosts' accommodating and friendly nature only added to our overall happiness with this exceptional property. Highly recommended for a memorable getaway.",5,4,4,4,5,4,,
116,17,22,"We were transported to a serene and tranquil oasis during our stay at this lakefront estate in Quebec, where the stunning views, cozy interior, and well-maintained garden provided the perfect backdrop for a peaceful retreat.",4,5,4,5,5,4,,
117,60,23,"My stay at this luxurious lakefront resort was absolutely amazing, with secluded surroundings, top-notch amenities, and an elegant ambiance making it the perfect retreat from the daily grind.",5,5,4,5,4,4,,
118,55,24,"This lakeside cabin is a hidden gem that offers a cozy and warm retreat, with breathtaking views of the lake that will leave you feeling peaceful and content.",4,5,4,5,4,5,,
119,61,25,"The cabin was a cozy and charming retreat, surrounded by stunning views of the lake and equipped with all the necessities for a comfortable stay, allowing us to disconnect from the outside world and truly embrace and enjoy nature.",4,4,5,4,5,5,,
120,32,26,"This cozy, spacious apartment offers breathtaking downtown views and all the amenities needed for a perfect stay, providing a remarkable and awe-inspiring experience.",5,4,5,5,5,5,,
121,100,27,We were absolutely blown away by the mesmerizing city views and luxurious amenities of this remodeled Edwardian home - it truly made our stay unforgettable!,5,4,5,5,5,5,,
122,5,28,"This place is an absolute gem - the breathtaking city views, private rooftop spa, and attention to detail create a luxurious and cozy experience that will leave you feeling like royalty.",4,4,5,4,5,5,,
123,39,29,"This luxurious urban oasis exceeded our expectations and offered a perfect combination of elegance, comfort, and convenience. From the private spa to the ideal location, it truly had it all.",4,4,5,5,4,5,,
124,100,1,"A heavenly escape with breathtaking scenery, luxurious glamping, and warm and welcoming hosts - I can't wait to return!",5,4,5,4,5,3,,
125,37,2,"Prepare to be with your breath taken away as you immerse yourself in this desert glamping experience overlooking Mount Palomar, where every detail has been thoughtfully created for your ultimate pleasure.",5,4,5,5,5,4,,
126,84,3,"Wow! This glamping site is a little slice of paradise, with jaw-dropping ocean views and exceptional service.",5,4,4,5,5,4,,
127,13,4,"This listing offers an unforgettable experience with stunning coastal views, remarkable architecture, and delightful hospitality that surpass expectations.",4,5,5,4,4,4,,
128,93,5,"Escape to the captivating beauty of Northern California at this exquisite waterfront bungalow, where modern luxury harmonizes with nature's enchantment.",5,4,5,5,5,4,,
129,17,6,"This waterfront bungalow offered the perfect blend of serenity and coziness, making it our personal haven.",5,5,4,4,5,4,,
130,31,7,This listing exceeded all expectations and is a must-visit destination for a perfect retreat.,3,4,4,4,5,5,,
131,26,8,"This hidden gem near San Francisco offers a refreshing and exciting getaway, perfect for a peaceful escape or an adventurous beach vacation.",4,5,5,4,4,4,,
132,95,9,"Indulge in pure bliss at this hidden coastal paradise offering breathtaking ocean views and a peaceful hot tub, making it the perfect escape for your ultimate rejuvenation.",4,4,5,5,4,5,,
133,82,10,"Experience a whimsical and tranquil hideaway amidst nature's embrace, where modern comfort seamlessly blends with ethereal enchantment.",4,5,4,5,4,4,,
134,99,11,Prepare to be transported to a serene haven nestled in the forest - this enchanting cabin guarantees an unforgettable vacation.,5,5,4,5,5,4,,
135,10,12,"This enchanting oasis is a dream come true, radiating warmth and offering breathtaking views that will leave a lasting impression.",4,5,4,5,4,5,,
136,56,13,The stay at the historic schoolhouse near Monterey Bay was like stepping into a magical oasis of tranquility and enchantment.,5,5,4,4,4,5,,
137,74,14,"Indulge in pure opulence at this secluded vineyard hideaway, where the infinity pool and intimate atmosphere create an unforgettable escape.",5,5,5,5,3,5,,
138,69,15,"Experience pure tranquility at this environmentally conscious oasis in Joshua Tree, offering breathtaking vistas and a soothing connection to the natural world.",4,5,5,5,5,4,,
139,71,16,"Eagle's Watch is a hidden gem with stunning ocean views, eco-friendly design, and a warm and inviting atmosphere - a perfect sanctuary.",5,4,5,5,4,5,,
140,72,17,Indulge in absolute opulence and tranquility as you soak up the breathtaking vistas from this exceptional architectural gem.,5,4,5,4,5,4,,
141,94,18,Escape to this flawlessly executed desert retreat for the ultimate pampering experience that will leave you feeling refreshed and indulged.,4,5,4,4,5,4,,
142,46,20,Experience ultimate luxury and unobstructed views of Lake Tahoe while enjoying the ease of secure parking.,5,5,4,4,5,5,,
143,19,21,"A hidden gem with meticulous hosts and a breathtaking nature reserve just steps away, making for an unforgettable escape.",5,4,5,3,5,4,,
144,2,22,"A slice of paradise with serene lakefront views, an enchanting interior, and a stunningly manicured garden.",5,5,5,5,3,5,,
145,59,23,"Immerse yourself in luxurious tranquility at this lakeside resort, where stunning natural beauty, upscale amenities, and an elegant ambiance combine to deliver a truly unforgettable retreat.",5,4,5,4,4,4,,
146,61,24,Experience pure serenity and breathtaking lakefront vistas at this enchanting cabin retreat.,5,4,4,4,5,4,,
147,88,25,Escape the hustle and bustle and indulge in serene lakeside living surrounded by breathtaking natural beauty.,5,4,5,4,5,4,,
148,24,26,Experience a breathtaking and unforgettable stay in this stunning apartment with panoramic city views and all the essential amenities.,5,4,4,5,5,3,,
149,60,27,This renovated Edwardian home offered us an unforgettable experience with its stunning city views and luxurious amenities.,4,5,5,5,4,4,,
150,16,28,"Experience the epitome of opulence and tranquility with breathtaking cityscape vistas, a secluded rooftop spa, and immaculate craftsmanship that guarantees an indulgent and captivating escape.",4,5,5,4,5,5,,
151,62,29,"This glamorous city oasis exceeded every expectation, seamlessly blending luxury, coziness, and convenience with the added bonus of a secluded spa and an enviable location.",4,5,4,5,4,5,,
152,12,1,"This listing is a slice of paradise with picturesque views, lavish glamping accommodations, and gracious hosts who made me feel right at home - I'm counting down the days until my next visit!",5,4,4,4,4,4,,
153,52,2,"Indulge in the ultimate desert glamping experience with breathtaking views of Mount Palomar, where every detail is meticulously designed for your utmost delight.",4,5,5,5,4,5,,
154,18,3,This glamping site exceeded all expectations with its stunning ocean panoramas and top-notch hospitality.,5,5,3,4,4,4,,
155,91,4,"This listing guarantees an unparalleled experience with breathtaking ocean vistas, extraordinary design, and exceptional service that goes above and beyond.",5,5,5,5,5,5,,
156,46,5,Immerse yourself in the perfect blend of luxurious modernity and Mother Nature's spellbinding charm at this stunning waterfront bungalow in Northern California.,5,5,5,4,5,5,,
157,1,6,Escape to this tranquil waterfront sanctuary boasting a harmonious fusion of serenity and charm.,4,4,5,5,4,5,,
158,32,7,"This listing is a hidden gem that will surpass your wildest expectations, offering an idyllic haven for an unforgettable getaway.",5,4,4,4,5,4,,
159,53,8,Escape to this hidden gem near San Francisco for an exhilarating and rejuvenating beach vacation that will leave you feeling refreshed and full of adventure.,4,4,4,5,4,5,,
160,5,9,Escape to this hidden coastal retreat with stunning ocean views and a serene hot tub for the ultimate in relaxation and renewal.,5,5,5,4,5,5,,
161,29,10,Escape to a magical oasis where nature meets contemporary luxury in perfect harmony.,5,5,5,5,5,5,,
162,6,11,Escape to a tranquil woodland retreat and create memories that will last a lifetime in this charming cabin.,5,4,5,4,4,5,,
163,100,12,"Indulge in the magical surroundings of this irresistible oasis, where your senses will be captivated by its cozy ambiance and awe-inspiring vistas.",5,4,5,5,4,5,,
164,31,13,This enchanting stay at the historic schoolhouse near Monterey Bay was a tranquil oasis that felt truly magical.,5,5,5,5,4,4,,
165,36,14,"Experience a luxuriously secluded retreat amidst picturesque vineyards, where the infinity pool and cozy ambiance immerse you in an unforgettable getaway.",4,4,4,5,5,5,,
166,38,15,Escape to this eco-friendly haven in Joshua Tree for a serene getaway surrounded by stunning views and a harmonious link to nature.,4,5,4,4,4,5,,
167,36,16,"Eagle's Watch is a little piece of paradise with mesmerizing ocean views, sustainable features, and a cozy ambiance - an idyllic sanctuary.",3,5,4,5,5,4,,
168,15,17,Experience pure luxury and serenity while immersing yourself in the awe-inspiring views of this extraordinary masterpiece.,4,5,4,4,5,4,,
169,14,18,Indulge in the ultimate pampering experience at this flawlessly executed desert retreat that will leave you refreshed and revitalized.,5,5,5,5,4,4,,
170,28,20,"Indulge in the epitome of opulence with breathtaking Lake Tahoe vistas, and the convenience of secure parking.",5,4,4,4,5,5,,
171,92,21,A secluded paradise where attentive hosts cater to your every need while you immerse yourself in stunning natural beauty.,4,4,5,4,5,4,,
172,14,22,"A tranquil sanctuary boasting breathtaking lake views, a captivating decor, and impeccably maintained grounds.",4,4,5,4,4,4,,
173,51,23,"Experience the epitome of serenity at this lakeside retreat, where opulent amenities and a refined atmosphere create an indelible escape.",5,5,5,4,5,4,,
174,37,24,Escape into a haven of tranquility with mesmerizing lake views at this captivating cabin hideaway.,4,5,5,5,5,4,,
175,24,25,"Experience tranquil lakeside living in a stunning natural setting, providing a getaway from the chaotic city life.",4,5,3,4,5,5,,
176,28,26,Indulge in a mesmerizing city escape where every moment in this exquisite apartment is filled with awe and comfort.,4,5,5,5,4,5,,
177,45,27,This renovated Edwardian home provided us with an exceptional stay featuring breathtaking city vistas and high-end amenities.,4,5,4,4,4,4,,
178,12,28,"Indulge in a captivating and opulent escape, surrounded by breathtaking city vistas and enhanced by a tranquil rooftop spa - a true sanctuary of craftsmanship and luxury.",5,4,4,4,5,5,,
179,30,29,"This listing is a tranquil paradise that went above and beyond, combining opulence, comfort, and accessibility, all complemented by a private spa and an unparalleled spot.",4,4,5,5,5,5,,